{
  "schema": "slopmop/v3",
  "command": "scour",
  "status": "ok",
  "exit_code": 0,
  "data": {
    "summary": {
      "total_checks": 38,
      "passed": 21,
      "failed": 0,
      "warned": 0,
      "skipped": 17,
      "not_applicable": 0,
      "errors": 0,
      "all_passed": true,
      "total_duration": 18.822,
      "scope": {
        "files": 65,
        "lines": 9090
      },
      "skip_reasons": {
        "sup": 1,
        "off": 16
      }
    },
    "passed_gates": [
      "myopia:dependency-risk.py",
      "myopia:interactive-assumptions",
      "laziness:repeated-code",
      "myopia:ambiguity-mines.py",
      "laziness:dead-code.py",
      "myopia:string-duplication.py",
      "deceptiveness:gate-dodging",
      "deceptiveness:bogus-tests.py",
      "laziness:sloppy-formatting.py",
      "overconfidence:missing-annotations.py",
      "overconfidence:type-blindness.py",
      "myopia:code-sprawl",
      "laziness:complexity-creep.py",
      "overconfidence:untested-code.py",
      "overconfidence:coverage-gaps.py",
      "myopia:just-this-once.py",
      "laziness:silenced-gates",
      "laziness:broken-templates.py",
      "laziness:debugger-artifacts",
      "myopia:github-actions-hygiene",
      "overconfidence:dangling-references"
    ],
    "results": [],
    "level": "scour",
    "hull_grade": {
      "grade": "A+",
      "level": "shipshape",
      "failing": 0,
      "warned": 0,
      "provisional": false,
      "findings": 0,
      "previous_findings": 3,
      "findings_delta": -3
    }
  },
  "next_steps": [
    {
      "action": "advance",
      "command": null,
      "reason": "Scour clean. Share results with the human and await the next instruction. Run sm sail when ready to push."
    }
  ]
}